<?xml version="1.0" encoding="utf-8"?>
 
<network xmlns:xsi="http://www.w3.org/2001/XMLSchema-instance"
         xsi:noNamespaceSchemaLocation="networkResources.xsd">
	<mail>
		<resources id="localhost" default="true"/>
	</mail>
	<ldap>
		<resources id="localhost" factoryResourcesId="ldap" default="true"/>
	</ldap>
	<webService>
		<resources id="localhost" default="true"/>
	</webService>
	<mq>
		<resources id="localhost" default="true"/>
	</mq>
</network>